<?xml version="1.0" encoding="UTF-8"?>
<xs:schema xmlns:xs="http://www.w3.org/2001/XMLSchema" elementFormDefault="qualified">
  <xs:element name="sales">
    <xs:complexType>
      <xs:sequence>
        <xs:element name="salesman" maxOccurs="unbounded">
          <xs:complexType>
            <xs:sequence>
              <xs:element name="name">
                <xs:complexType>
                  <xs:sequence>
                    <xs:element name="first" type="xs:string"/>
                    <xs:element name="middle" type="xs:string" minOccurs="0"/>
                    <xs:element name="last" type="xs:string"/>
                  </xs:sequence>
                  <xs:attribute name="title" type="xs:string" use="required"/>
                </xs:complexType>
              </xs:element>
              <xs:element name="phone">
                <xs:complexType>
                  <xs:simpleContent>
                    <xs:extension base="xs:integer">
                      <xs:attribute name="type" default="personal">
                        <xs:simpleType>
                          <xs:restriction base="xs:string">
                            <xs:enumeration value="personal"/>
                            <xs:enumeration value="work"/>
                            <xs:enumeration value="home"/>
                          </xs:restriction>
                        </xs:simpleType>
                      </xs:attribute>
                    </xs:extension>
                  </xs:simpleContent>
                </xs:complexType>
              </xs:element>
              <xs:element name="area" type="xs:string"/>
              <xs:element name="records">
                <xs:complexType>
                  <xs:sequence>
                    <xs:element name="product">
                      <xs:complexType>
                        <xs:sequence>
                          <xs:element name="sku" type="xs:string"/>
                          <xs:element name="productName" type="xs:string"/>
                        </xs:sequence>
                        <xs:attribute name="id" type="xs:ID" use="required"/>
                      </xs:complexType>
                    </xs:element>
                  <xs:element name="quantity" type="xs:integer"/>
                    <xs:element name="price">
                      <xs:complexType>
                        <xs:simpleContent>
                          <xs:extension base="xs:decimal">
                            <xs:attribute name="currency" default="NPR">
                              <xs:simpleType>
                                <xs:restriction base="xs:string">
                                  <xs:enumeration value="INR"/>
                                  <xs:enumeration value="NPR"/>
                                  <xs:enumeration value="USD"/>
                                </xs:restriction>
                              </xs:simpleType>
                            </xs:attribute>
                          </xs:extension>
                        </xs:simpleContent>
                      </xs:complexType>
                    </xs:element> 
                    <xs:element name="date">
                      <xs:complexType>
                        <xs:simpleContent>
                          <xs:extension base="xs:string">
                            <xs:attribute name="type">
                              <xs:simpleType>
                                <xs:restriction base="xs:string">
                                  <xs:enumeration value="AD"/>
                                  <xs:enumeration value="BS"/>
                                </xs:restriction>
                              </xs:simpleType>
                            </xs:attribute>
                          </xs:extension>
                        </xs:simpleContent>
                      </xs:complexType>
                    </xs:element>
                  </xs:sequence>
                </xs:complexType>
              </xs:element> </xs:sequence>
          </xs:complexType>
        </xs:element> </xs:sequence>
    </xs:complexType>
  </xs:element> 
  </xs:schema>
